{
  "limits": {},
  "params": {
    "integrator_limit": 2.0,
    "ki": 1.9655709520753062,
    "kp": 4.557756654244376
  },
  "policy_id": "pid_speed_search_9_s1",
  "policy_type": "pid_speed",
  "testsuite_overrides": {
    "controller": "foc",
    "dt": 0.001,
    "duration": 0.2,
    "log_root": "logs",
    "run_prefix": "iter_9_s1",
    "seed": 1
  },
  "with_identification": true
}
