{
  "limits": {},
  "params": {
    "dvq_max": 1505.6676877976988,
    "integrator_limit": 1.8252682461308305,
    "k_age": 0.06815142091019188,
    "ki": 1.2747988022586005,
    "kp": 1.2731382049111972,
    "tau_action": 0.020720319834182217,
    "vq_max": 225.05080700556206
  },
  "policy_id": "mic_rule_search_28_s1",
  "policy_type": "mic_rule",
  "testsuite_overrides": {
    "controller": "foc",
    "dt": 0.001,
    "duration": 0.2,
    "log_root": "logs",
    "run_prefix": "iter_28_s1",
    "seed": 1
  },
  "with_identification": true
}
